{
  "$schema": "http://json-schema.org/draft-07/schema#",
  "$id": "https://progressiveoverflow.com/schemas/progress.v1.json",
  "title": "cse-coach progress contract",
  "description": "The honest-progress data contract emitted by scripts/gamify.py and consumed by the progressiveoverflow.com dashboard. Any repo following the cse-coach schema can emit this file to be renderable. Curated + non-sensitive: aggregate stats, per-problem status and comfort timeline, and derived badges — never solution code or stuck-log prose. schemaVersion is bumped on any breaking change so a viewer can refuse an incompatible file. gamify.py ALSO emits progress-summary.json alongside this file — see $defs/summary below: same contract minus `problems[]`, with a compact `trophyCase`. The dashboard landing fetches the summary only; the full file (this schema) is fetched on explicit opt-in.",
  "type": "object",
  "required": ["schemaVersion", "generatedAt", "totals", "pipeline", "streak", "problems", "badges"],
  "additionalProperties": true,
  "properties": {
    "schemaVersion": { "type": "integer", "const": 1 },
    "generatedAt": { "type": "string", "format": "date" },
    "totals": {
      "type": "object",
      "required": ["problems", "solutions", "reps"],
      "properties": {
        "problems": { "type": "integer", "minimum": 0 },
        "solutions": { "type": "integer", "minimum": 0 },
        "reps": { "type": "integer", "minimum": 0 }
      }
    },
    "pipeline": {
      "type": "object",
      "description": "Counts along the maturation ladder 🔴 blank -> 🟡 shaky -> 🟢 clean (by streak) -> 🎓 graduated -> 🏆 retired.",
      "required": ["blank", "shaky", "clean", "graduated", "retired"],
      "properties": {
        "blank": { "type": "integer", "minimum": 0 },
        "shaky": { "type": "integer", "minimum": 0 },
        "clean": {
          "type": "object",
          "required": ["s0", "s1", "s2plus", "total"],
          "properties": {
            "s0": { "type": "integer", "minimum": 0 },
            "s1": { "type": "integer", "minimum": 0 },
            "s2plus": { "type": "integer", "minimum": 0 },
            "total": { "type": "integer", "minimum": 0 }
          }
        },
        "graduated": { "type": "integer", "minimum": 0 },
        "retired": { "type": "integer", "minimum": 0 }
      }
    },
    "difficulty": {
      "type": "object",
      "properties": {
        "Easy": { "type": "integer", "minimum": 0 },
        "Medium": { "type": "integer", "minimum": 0 },
        "Hard": { "type": "integer", "minimum": 0 }
      }
    },
    "streak": {
      "type": "object",
      "description": "SR-honest study-day streak: rewards practicing when due, with a rest-day allowance, never raw daily grind.",
      "required": ["current", "longest", "studyDays", "restDayAllowance"],
      "properties": {
        "current": { "type": "integer", "minimum": 0 },
        "longest": { "type": "integer", "minimum": 0 },
        "lastStudyDay": { "type": ["string", "null"], "format": "date" },
        "studyDays": { "type": "integer", "minimum": 0 },
        "restDayAllowance": { "type": "integer", "minimum": 0 }
      }
    },
    "coverage": {
      "type": ["object", "null"],
      "description": "Technique breadth, from technique_coverage.md. null when that file was unreadable.",
      "properties": {
        "total": { "type": "integer" },
        "started": { "type": "integer" },
        "noGreen": { "type": "integer" },
        "thin": { "type": "integer" },
        "variantGaps": { "type": "integer" }
      }
    },
    "onSchedule": {
      "type": "object",
      "description": "SR adherence gauge derived from each row's Next Review Date vs today.",
      "properties": {
        "totalActive": { "type": "integer", "minimum": 0 },
        "dueToday": { "type": "integer", "minimum": 0 },
        "overdue": { "type": "integer", "minimum": 0 }
      }
    },
    "trophyCase": {
      "type": "object",
      "properties": {
        "graduated": { "type": "array", "items": { "$ref": "#/definitions/problem" } },
        "retired": {
          "type": "array",
          "items": {
            "type": "object",
            "properties": {
              "lcNumber": { "type": "integer" },
              "title": { "type": "string" },
              "retiredOn": { "type": "string", "format": "date" }
            }
          }
        }
      }
    },
    "badges": {
      "type": "array",
      "description": "Derived achievements. Every trigger keys off a genuine, unfakeable event (a graduation, a retirement, a comeback, a study-day streak) — never a raw count of easy greens and never a rating.",
      "items": {
        "type": "object",
        "required": ["id", "title", "earned"],
        "properties": {
          "id": { "type": "string" },
          "title": { "type": "string" },
          "icon": { "type": "string" },
          "description": { "type": "string" },
          "earned": { "type": "boolean" }
        }
      }
    },
    "problems": {
      "type": "array",
      "items": { "$ref": "#/definitions/problem" }
    },
    "techniques": {
      "type": "array",
      "description": "Per-technique row from technique_coverage.md's Coverage table — the drill-through detail behind the technique-breadth header. Small (~56 rows); present in BOTH progress.json and progress-summary.json so the technique panel renders instantly with no extra fetch.",
      "items": { "$ref": "#/definitions/technique" }
    },
    "studyDays": {
      "type": "array",
      "description": "Sorted distinct ISO dates the learner practiced — the list form behind streak.studyDays (a count). Backs the streak calendar drill. In progress.json (this schema) this is the COMPLETE lifetime list. In progress-summary.json it is a ROLLING WINDOW (the last ~26 weeks / SUMMARY_STUDY_DAYS_WINDOW days, gamify.py's summary_of()) — enough for the calendar, capped so the summary can't grow forever. The lifetime COUNT is unaffected: read streak.studyDays / streak.longest for that, never the length of this array in the summary.",
      "items": { "type": "string", "format": "date" }
    },
    "schedule": {
      "type": ["object", "null"],
      "description": "The CURRENT week's Daily Schedule table — the compact slice behind the dashboard's Today's-board drill (\"what do I do today\"). null when no current weekly schedule file was found. Present in BOTH progress.json and progress-summary.json (one week of compact rows, small either way). Carries ALL 7 days; the viewer picks 'today' by its OWN local date against each day's `date` — this file never bakes in a server-side today, since the summary can be viewed days after it was generated.",
      "required": ["weekOf", "days"],
      "properties": {
        "weekOf": { "type": "string", "format": "date", "description": "ISO date of the week's Monday." },
        "days": { "type": "array", "minItems": 7, "maxItems": 7, "items": { "$ref": "#/definitions/scheduleDay" } }
      }
    },
    "warnings": {
      "type": "array",
      "description": "Fail-soft notes about inputs that could not be fully read; a partial file is still valid.",
      "items": { "type": "string" }
    }
  },
  "definitions": {
    "summary": {
      "description": "The shape of progress-summary.json: this contract minus `problems[]`, with a compact `trophyCase` (graduated entries reduced to {lcNumber, title, difficulty} — no timeline/repDates; retired entries unchanged). Written by the same gamify.py run via summary_of().",
      "type": "object",
      "required": ["schemaVersion", "generatedAt", "totals", "pipeline", "streak", "badges"],
      "properties": {
        "schemaVersion": { "type": "integer", "const": 1 },
        "generatedAt": { "type": "string", "format": "date" },
        "totals": { "$ref": "#/properties/totals" },
        "pipeline": { "$ref": "#/properties/pipeline" },
        "difficulty": { "$ref": "#/properties/difficulty" },
        "streak": { "$ref": "#/properties/streak" },
        "coverage": { "$ref": "#/properties/coverage" },
        "onSchedule": { "$ref": "#/properties/onSchedule" },
        "badges": { "$ref": "#/properties/badges" },
        "techniques": { "$ref": "#/properties/techniques" },
        "studyDays": { "$ref": "#/properties/studyDays" },
        "schedule": { "$ref": "#/properties/schedule" },
        "trophyCase": {
          "type": "object",
          "properties": {
            "graduated": {
              "type": "array",
              "items": {
                "type": "object",
                "properties": {
                  "lcNumber": { "type": "integer" },
                  "title": { "type": "string" },
                  "difficulty": { "type": "string", "enum": ["Easy", "Medium", "Hard"] }
                }
              }
            },
            "retired": {
              "type": "array",
              "items": {
                "type": "object",
                "properties": {
                  "lcNumber": { "type": "integer" },
                  "title": { "type": "string" },
                  "retiredOn": { "type": "string", "format": "date" }
                }
              }
            }
          }
        }
      }
    },
    "technique": {
      "type": "object",
      "description": "One row of technique_coverage.md's Coverage table.",
      "required": ["name", "family", "problemCount", "problems", "hasGreen", "thin", "hasVariantGap"],
      "properties": {
        "name": { "type": "string" },
        "family": { "type": "string" },
        "problemCount": { "type": "integer", "minimum": 0 },
        "problems": { "type": "array", "items": { "type": "integer" }, "description": "LC numbers inside the table cell's parenthetical; excludes *+Nv* variant-rep annotations." },
        "bestComfort": { "type": ["string", "null"], "enum": ["🔴", "🟡", "🟢", "🎓", "🏆", null] },
        "hasGreen": { "type": "boolean" },
        "thin": { "type": "boolean", "description": "Fewer than the 3-4 surface forms the technique needs." },
        "hasVariantGap": { "type": "boolean", "description": "A declared method variant has never once been exercised." }
      }
    },
    "scheduleDay": {
      "type": "object",
      "description": "One day of the current week's board.",
      "required": ["date", "weekday", "items"],
      "properties": {
        "date": { "type": "string", "format": "date" },
        "weekday": { "type": "string", "description": "Full weekday name, e.g. 'Monday'." },
        "label": { "type": ["string", "null"], "description": "The day header's trailing note (after the units), e.g. '22 🔴 re-rep + Greedy/Trie/Dijkstra reviews'. null if the header carried none." },
        "units": { "type": ["number", "null"], "description": "Stated effort-budget units for the day, if the header carried one." },
        "items": { "type": "array", "items": { "$ref": "#/definitions/scheduleItem" } }
      }
    },
    "scheduleItem": {
      "type": "object",
      "description": "One row of a schedule day's Daily Schedule table.",
      "required": ["lcNumber", "title", "technique", "startComfort", "done"],
      "properties": {
        "lcNumber": { "type": ["integer", "null"], "description": "null for a 🆕 intake row not yet scaffolded to a local solution file — the row's Problem cell has no `[` / `**` before its number for eb.SCHED_NUM to find (by design, mirrors effort_budget.py)." },
        "title": { "type": "string" },
        "technique": { "type": ["string", "null"] },
        "startComfort": { "type": ["string", "null"], "enum": ["🔴", "🟡", "🟢", "🎓", null], "description": "The comfort glyph as written at the weekly build (col S) — null for a 🆕/🎯-tagged row, which carries no prior comfort." },
        "done": { "type": "boolean", "description": "True when the row is struck through (`~~...~~`) in the source table." }
      }
    },
    "problem": {
      "type": "object",
      "required": ["lcNumber", "title", "comfort", "repDates", "timeline"],
      "properties": {
        "lcNumber": { "type": "integer" },
        "title": { "type": "string" },
        "url": { "type": ["string", "null"], "description": "Canonical LeetCode URL for deep-linking." },
        "difficulty": { "type": "string", "enum": ["Easy", "Medium", "Hard"] },
        "category": { "type": ["string", "null"] },
        "comfort": { "type": "string", "enum": ["🔴", "🟡", "🟢", "🎓", "🏆"] },
        "level": { "type": ["integer", "null"], "description": "Comfort as an ordinal 0-4 for plotting." },
        "streak": { "type": "integer", "minimum": 0 },
        "nextReview": { "type": "string", "format": "date" },
        "repDates": { "type": "array", "items": { "type": "string", "format": "date" } },
        "timeline": {
          "type": "array",
          "description": "Per-rep comfort earned, reconstructed from the weekly schedules. comfort is null where a rep predates the schedule archive — an activity dot, never a fabricated value.",
          "items": {
            "type": "object",
            "required": ["date"],
            "properties": {
              "date": { "type": "string", "format": "date" },
              "comfort": { "type": ["string", "null"] },
              "level": { "type": ["integer", "null"] }
            }
          }
        }
      }
    }
  }
}
