{
  "schemaVersion": 1,
  "generatedAt": "2026-09-21",
  "totals": {
    "problems": 123,
    "solutions": 134,
    "reps": 589
  },
  "pipeline": {
    "blank": 2,
    "shaky": 16,
    "clean": {
      "s0": 1,
      "s1": 29,
      "s2plus": 66,
      "total": 96
    },
    "graduated": 20,
    "retired": 0
  },
  "difficulty": {
    "Easy": 34,
    "Medium": 89,
    "Hard": 11
  },
  "streak": {
    "current": 116,
    "longest": 116,
    "lastStudyDay": "2026-09-20",
    "studyDays": 174,
    "restDayAllowance": 1
  },
  "coverage": {
    "total": 56,
    "started": 56,
    "noGreen": 0,
    "thin": 18,
    "variantGaps": 3
  },
  "onSchedule": {
    "totalActive": 134,
    "dueToday": 5,
    "overdue": 4
  },
  "trophyCase": {
    "graduated": [
      {
        "lcNumber": 199,
        "title": "Binary Tree Right Side View",
        "url": "https://leetcode.com/problems/binary-tree-right-side-view/",
        "difficulty": "Medium",
        "category": "trees",
        "comfort": "🎓",
        "level": 3,
        "streak": 3,
        "nextReview": "2027-03-19",
        "repDates": [
          "2026-05-09",
          "2026-06-13",
          "2026-07-14",
          "2026-09-20"
        ],
        "timeline": [
          {
            "date": "2026-05-09",
            "comfort": null,
            "level": null
          },
          {
            "date": "2026-06-13",
            "comfort": null,
            "level": null
          },
          {
            "date": "2026-07-14",
            "comfort": null,
            "level": null
          },
          {
            "date": "2026-09-20",
            "comfort": "🎓",
            "level": 3
          }
        ]
      },
      {
        "lcNumber": 206,
        "title": "Reverse Linked List (Iterative)",
        "url": "https://leetcode.com/problems/reverse-linked-list/",
        "difficulty": "Easy",
        "category": "linked_list",
        "comfort": "🎓",
        "level": 3,
        "streak": 3,
        "nextReview": "2027-03-18",
        "repDates": [
          "2026-04-23",
          "2026-05-26",
          "2026-06-12",
          "2026-06-20",
          "2026-07-20",
          "2026-09-19"
        ],
        "timeline": [
          {
            "date": "2026-04-23",
            "comfort": null,
            "level": null
          },
          {
            "date": "2026-05-26",
            "comfort": null,
            "level": null
          },
          {
            "date": "2026-06-12",
            "comfort": null,
            "level": null
          },
          {
            "date": "2026-06-20",
            "comfort": null,
            "level": null
          },
          {
            "date": "2026-07-20",
            "comfort": null,
            "level": null
          },
          {
            "date": "2026-09-19",
            "comfort": "🎓",
            "level": 3
          }
        ]
      },
      {
        "lcNumber": 21,
        "title": "Merge Two Sorted Lists (Recursion)",
        "url": "https://leetcode.com/problems/merge-two-sorted-lists/",
        "difficulty": "Easy",
        "category": "linked_list",
        "comfort": "🎓",
        "level": 3,
        "streak": 3,
        "nextReview": "2027-03-18",
        "repDates": [
          "2026-05-20",
          "2026-05-21",
          "2026-06-12",
          "2026-06-20",
          "2026-07-20",
          "2026-09-19"
        ],
        "timeline": [
          {
            "date": "2026-05-20",
            "comfort": null,
            "level": null
          },
          {
            "date": "2026-05-21",
            "comfort": null,
            "level": null
          },
          {
            "date": "2026-06-12",
            "comfort": null,
            "level": null
          },
          {
            "date": "2026-06-20",
            "comfort": null,
            "level": null
          },
          {
            "date": "2026-07-20",
            "comfort": null,
            "level": null
          },
          {
            "date": "2026-09-19",
            "comfort": "🎓",
            "level": 3
          }
        ]
      },
      {
        "lcNumber": 130,
        "title": "Surrounded Regions (BFS)",
        "url": "https://leetcode.com/problems/surrounded-regions/",
        "difficulty": "Medium",
        "category": "graphs",
        "comfort": "🎓",
        "level": 3,
        "streak": 3,
        "nextReview": "2027-03-18",
        "repDates": [
          "2026-06-14",
          "2026-06-20",
          "2026-07-20",
          "2026-09-19"
        ],
        "timeline": [
          {
            "date": "2026-06-14",
            "comfort": null,
            "level": null
          },
          {
            "date": "2026-06-20",
            "comfort": null,
            "level": null
          },
          {
            "date": "2026-07-20",
            "comfort": null,
            "level": null
          },
          {
            "date": "2026-09-19",
            "comfort": "🎓",
            "level": 3
          }
        ]
      },
      {
        "lcNumber": 283,
        "title": "Move Zeroes",
        "url": "https://leetcode.com/problems/move-zeroes/",
        "difficulty": "Easy",
        "category": "two_pointers",
        "comfort": "🎓",
        "level": 3,
        "streak": 3,
        "nextReview": "2027-03-18",
        "repDates": [
          "2026-01-10",
          "2026-04-02",
          "2026-06-02",
          "2026-06-12",
          "2026-07-19",
          "2026-09-19"
        ],
        "timeline": [
          {
            "date": "2026-01-10",
            "comfort": null,
            "level": null
          },
          {
            "date": "2026-04-02",
            "comfort": null,
            "level": null
          },
          {
            "date": "2026-06-02",
            "comfort": null,
            "level": null
          },
          {
            "date": "2026-06-12",
            "comfort": null,
            "level": null
          },
          {
            "date": "2026-07-19",
            "comfort": null,
            "level": null
          },
          {
            "date": "2026-09-19",
            "comfort": "🎓",
            "level": 3
          }
        ]
      },
      {
        "lcNumber": 102,
        "title": "Binary Tree Level Order Traversal",
        "url": "https://leetcode.com/problems/binary-tree-level-order-traversal/",
        "difficulty": "Medium",
        "category": "trees",
        "comfort": "🎓",
        "level": 3,
        "streak": 3,
        "nextReview": "2027-03-16",
        "repDates": [
          "2026-05-03",
          "2026-06-12",
          "2026-07-19",
          "2026-09-17"
        ],
        "timeline": [
          {
            "date": "2026-05-03",
            "comfort": null,
            "level": null
          },
          {
            "date": "2026-06-12",
            "comfort": null,
            "level": null
          },
          {
            "date": "2026-07-19",
            "comfort": null,
            "level": null
          },
          {
            "date": "2026-09-17",
            "comfort": "🎓",
            "level": 3
          }
        ]
      },
      {
        "lcNumber": 242,
        "title": "Valid Anagram",
        "url": "https://leetcode.com/problems/valid-anagram/",
        "difficulty": "Easy",
        "category": "arrays_and_hash",
        "comfort": "🎓",
        "level": 3,
        "streak": 3,
        "nextReview": "2027-03-15",
        "repDates": [
          "2026-01-01",
          "2026-03-25",
          "2026-06-22",
          "2026-07-22",
          "2026-09-16"
        ],
        "timeline": [
          {
            "date": "2026-01-01",
            "comfort": null,
            "level": null
          },
          {
            "date": "2026-03-25",
            "comfort": null,
            "level": null
          },
          {
            "date": "2026-06-22",
            "comfort": null,
            "level": null
          },
          {
            "date": "2026-07-22",
            "comfort": null,
            "level": null
          },
          {
            "date": "2026-09-16",
            "comfort": "🎓",
            "level": 3
          }
        ]
      },
      {
        "lcNumber": 261,
        "title": "Graph Valid Tree (Union-Find)",
        "url": "https://neetcode.io/problems/valid-tree",
        "difficulty": "Medium",
        "category": "graphs",
        "comfort": "🎓",
        "level": 3,
        "streak": 3,
        "nextReview": "2027-03-14",
        "repDates": [
          "2026-06-19",
          "2026-06-29",
          "2026-07-09",
          "2026-07-18",
          "2026-08-01",
          "2026-08-31",
          "2026-09-15"
        ],
        "timeline": [
          {
            "date": "2026-06-19",
            "comfort": null,
            "level": null
          },
          {
            "date": "2026-06-29",
            "comfort": null,
            "level": null
          },
          {
            "date": "2026-07-09",
            "comfort": null,
            "level": null
          },
          {
            "date": "2026-07-18",
            "comfort": null,
            "level": null
          },
          {
            "date": "2026-08-01",
            "comfort": null,
            "level": null
          },
          {
            "date": "2026-08-31",
            "comfort": null,
            "level": null
          },
          {
            "date": "2026-09-15",
            "comfort": "🎓",
            "level": 3
          }
        ]
      },
      {
        "lcNumber": 200,
        "title": "Number of Islands (DFS)",
        "url": "https://leetcode.com/problems/number-of-islands/",
        "difficulty": "Medium",
        "category": "graphs",
        "comfort": "🎓",
        "level": 3,
        "streak": 3,
        "nextReview": "2027-03-13",
        "repDates": [
          "2026-05-31",
          "2026-06-02",